"primary_key","object_id","product_family_id","product_family_name","product_family_number","laststreameddate","itemnumber","itemname","description_of_issue","state","operating_company","segment","creation_date","escalation_lead_or_quality_rep","action_plan_or_proposed_action","highest_escalation_level_reached","user_comments"
"01966ca2-7ddd-7085-bc3d-0966f1ce7f5a-1e0ed73f-564f-4181-84b5-45a9f9bf683d-1234-$record.itemRef","1e0ed73f-564f-4181-84b5-45a9f9bf683d","01966ca2-7ddd-7085-bc3d-0966f1ce7f5a",CypressTC2 – Streamer Test,"1234",2025-05-03 00:00:00.000,"2194242",Level 2- AC-077A301 Miscommunication of Interim Analysis recommendation from IDMC to Sponsor Committee,"After interim analysis for the AC-077A301 trial the IDMC reflected in its meeting minutes a recommendation to stop the study due to efficacy in March 2022. However, the recommendation provided to the Sponsor Committee by the IDMC on 21Mar22 was to stop the study (no reason specified). The recruitment was then stopped, and patients continued in double blind phase potentially delaying their transition to open label treatment.

The AC-077A301 (A DUE) trial Independent Data Monitoring Committee (IDMC) completed their review of the Interim Analysis (IA) data in March 2022 with recommendation to stop the study per the blinded IDMC meeting report.  In review of communications from March 2022 between the IDMC and the SC the understanding of this recommendation was that the study was to stop recruitment of new patients and complete the final planned analysis; however, upon review of the closed session meeting minutes in November 2022 the IDMC had recommended to stop the study due to efficacy - which was not done.  

The IDMC had a regular meeting in May 2022 where a written recommendation was provided to continue study unmodified until next scheduled meeting. 

The study participants continued in the double-blind phase of the A DUE trial instead of completing the end of double-blind treatment visit (EDBT) and transition to the open label phase of the trial and be receiving the Fixed-dose-combination treatment if study had stopped for efficacy.  The study participants not included in the IA primary analysis were potentially delayed in moving to the open label phase of the trial until after completion of Week 16 visit.  Impact assessment for safety and efficacy is pending.

A quality investigation is in progress to assess root cause of the miscommunication and impact assessment for patients under monotherapy that continued in the double-blind phase.",Closed,Janssen Pharmaceutical,Pharma - R&D,2022-11-22 16:22:08.000,"NIZNIK, MICHELLE","Complete impact assessment for safety and efficacy for patients in monotherapy arm that did not transfer to open label phase after IDMC meeting in March 2022.

Assess potential enhancements to IDMC charter or IDMC meeting report and recommendation template /script to ensure clarity  in communications and recommendations at IA.

Request any additional communications from Sponsor Committee and IDMC members related to outcome of interim analysis and to recommendation made.",No Subsequent Escalation,
"01966ca2-7ddd-7085-bc3d-0966f1ce7f5a-d5332637-8901-403c-91a7-0163b7910a1f-1234-$record.itemRef",d5332637-8901-403c-91a7-0163b7910a1f,"01966ca2-7ddd-7085-bc3d-0966f1ce7f5a",CypressTC2 – Streamer Test,"1234",2025-05-03 00:00:00.000,"2206952",Level 1-Two Quetiapine IP kits were lost at Site AR10011 for protocol TRD3013 in Argentina,"Trigger for Escalation:  Quetiapine is a controlled substance in Argentina and loss is reportable to the Health Authority.  There is no expected impact to the Esketamine 5413419TRD3013 trial or submission. 

On January 2022, patient attended to a scheduled visit, and the Study Coordinator (SC) assigned 2 Quetiapine kits of 150 mg each (205981, 205982).
Before the patient left the site, the SC noticed that kits were assigned in error, and new Quetiapine kits of 300 mg each were assigned and dispensed.
The two 150 mg kits were not at site after the final reconciliation, and the vendor (Fisher) was requested to open all the boxes sent for destruction.
On November 24th, Fisher confirmed that the kits were not found in any box. 
On December 15th, the backup Site Monitor performed an Onsite Monitoring Visit for the TRD4010 study and investigated the lost kits at the site with the SC, however, was not able to locate the kits.

SM review with site staff the IP return procedure and re-enforced the importance of keeping the dispensed and returned kits in a safe place, whether they contain medication or are empty.

-Site staff to notify Local Police and their Ethics Committee 
-Sponsor/Study Team will notify local regulatory Agency as applicable
-Study Team to notify JNJ Global security and Controlled Substance Group",Closed,Janssen Pharmaceutical,Pharma - R&D,2022-12-19 21:56:03.000,"NIZNIK, MICHELLE","Site Monitor reviewed with site staff the IP return procedure and re-enforced the importance of keeping the dispensed and returned kits in a safe place, whether they contain medication or are empty.  Training to be documented.

-Site staff to notify Local Police and their Ethics Committee 
-Sponsor/Study Team will notify local regulatory Agency as applicable
-Study Team send notification to JNJ Global security and Controlled Substance Group on 19-Dec-2022",No Subsequent Escalation,
"01966ca2-7ddd-7085-bc3d-0966f1ce7f5a-4b97976a-96b5-4e0d-b39c-24031475d472-1234-$record.itemRef","4b97976a-96b5-4e0d-b39c-24031475d472","01966ca2-7ddd-7085-bc3d-0966f1ce7f5a",CypressTC2 – Streamer Test,"1234",2025-05-03 00:00:00.000,"2239862","LEVEL 1-54179060MCL3004 Suspected Misconduct of a Pharmacy Technician, Univ. of Istanbul","Trigger for escalation: Suspected misconduct at a clinical trial site as reported by the primary investigator and associated reporting to the Ministry of Health (HA Turkey) and EC.  The primary investigator reported to the study monitor that a pharmacy technician, delegated for preparation of rituximab, was dismissed on 03 MAR 2023 from the institution due to suspected intentional misconduct related to investigational product preparation. On 09 MAR 2023, the local team from Turkey informed the 54179060MCL3004 (VEGA) study team about the information reported by the primary investigator.  

•	There is an ongoing internal investigation at the site being conducted by law enforcement and the site staff (PI and investigators) to determine impact in the preparation for the VEGA subject’s Rituximab IV administration.  

•	The subject received 3 doses that were prepared by this pharmacy technician on Cycle 1 on 29 DEC 2022, Cycle 2 administered on 27 JAN 2023, and cycle 3 administered on 24 Feb 2023.  Only one subject 900003 was administered Rituximab which was prepared by this pharmacy technician.  

•	The VEGA SRP confirmed there are no major safety concerns for this subject as the subject did receive Lenalidomide which is active and registered drug in this indication.  

Impact: 
The Pharmacy Tech was delegated for IP preparation for studies: 54179060MCL3004 and 64407564MMY3002.   For the MCL3004 study, Subject # 900003, 1 subject on treatment potentially impacted.  No other patients impacted at this site.  For MMY3002, there is no impact to this study since the pharmacy tech was dismissed prior to the site’s first subject’s first dose.",Closed,Janssen Pharmaceutical,Pharma - R&D,2023-03-16 18:48:43.000,"Moya, Isabelle","•	The patient will return for a study visit on 23 MAR 2023.   

•	Exploring possibility of a serum test to determine trial integrity and the reporting of outcome within the CSR.  The serum test may confirm if this patient received Rituximab.  

•	Additional potential actions will be determined in consultation with the Global Legal Organization",No Subsequent Escalation,
"01966ca2-7ddd-7085-bc3d-0966f1ce7f5a-5f30a92e-70d3-4936-93af-3e15caf1057b-1234-$record.itemRef","5f30a92e-70d3-4936-93af-3e15caf1057b","01966ca2-7ddd-7085-bc3d-0966f1ce7f5a",CypressTC2 – Streamer Test,"1234",2025-05-03 00:00:00.000,"2254022",Use before date of VesiCulture product in trial 17000139BLC3002,Third party product Vesiculture was packaged in kit P&L orders T323376 and T335839 for use in trial 17000139BLC3002. The orders were released with an incorrect expiry date (1 month too long). The expiry date was based on the original expiry date listed in the CoA and commercial packaging of VesiCulture by manufacturer AJ Vaccines. It was however not noticed that AJ Vaccines had reported the expiry date as a 'Use before' date instead of Expiry date. Both orders were therefore assigned a Janssen expiry date going 1 month beyond the actual expiry of the product.,Closed,Janssen Pharmaceutical,Pharma - R&D,2023-04-25 12:25:17.000,"VAN HEUVERSWYN, Maite","1. Availability of additional stability information to cover the additional month to be requested from AJ Vaccines to complete the investigation documentation.
2. 
- Order T345977 will be reworked (update expiry labeling per TV-SOP-09605) at P&L facility Catalent Schorndorf, Germany as soon as possible.
- Order T335839 will be reworked (update expiry labeling per TV-SOP-09605) at clinical sites and/or depots or will be damaged out once correct re-supply is available, to avoid immediate patient/trial impact.",No Subsequent Escalation,
"01966ca2-7ddd-7085-bc3d-0966f1ce7f5a-834b122f-1c60-4022-a5dd-2f4a54f1dc6c-1234-$record.itemRef","834b122f-1c60-4022-a5dd-2f4a54f1dc6c","01966ca2-7ddd-7085-bc3d-0966f1ce7f5a",CypressTC2 – Streamer Test,"1234",2025-05-03 00:00:00.000,"2262672","Level 2 Failure to obtain informed consent for DNA sampling, but samples obtained, across multiple sites/countries","Trigger for escalation:  45 patients had DNA samples collected without signing ICF across multiple sites and countries, impacting patient rights. Informed consent must be collected for all procedures for all patients under ICH and GCP requirements. HA reporting will be required as a result of improper informed consent (ICF) practices. 

Background:  on 14Feb2023, Parexel received information from Labcorp that DNA collection tubes were erroneously included in Week 0 kits.  Parexel local teams requested CRAs notify site teams to remove the collection tube.  MCT (subcontracted by PXL) CRAs in Jordan did not perform this task, and DNA sampling is not EC approved for any patient in Jordan, so in total 32 patients in Jordan had DNA sampling completed without informed consent.  This necessitates HA reporting in Jordan.  A total of twelve sites are impacted across eight countries.",Closed,Janssen Pharmaceutical,Pharma - R&D,2023-05-18 14:17:12.000,"PATEL, BHAVESH","PXL is conducting a Quality Investigation (307950).  Actions proposed by Parexel:
  
•	Communication to lab vendor (Covance/Labcorp) to be sent by Parexel describing the issue and request to destroy samples, to be followed up until destruction confirmed
•	Communication to sites from Parexel that samples have been destroyed, when this has occurred
•	Each individual issue reported as a PD in Parexel's system
•	Parexel's vendor MCT to retrain sites about protocol requirements and regulations related to DNA sample collection, which will be documented in Parexel training log and monitoring visit report",No Subsequent Escalation,
"01966ca2-7ddd-7085-bc3d-0966f1ce7f5a-6870516e-0922-4e49-a03f-931830102b17-1234-$record.itemRef","6870516e-0922-4e49-a03f-931830102b17","01966ca2-7ddd-7085-bc3d-0966f1ce7f5a",CypressTC2 – Streamer Test,"1234",2025-05-03 00:00:00.000,"2327732","Level 1: HA Italy conditional approval for SunRIse 1, 2, 3, 4, requiring device application and temp. enrollment hold","Executive Summary: 
Trigger for Escalation:   AIFA (HA Italy) placed a conditional approval for the SunRIse trials, requesting a separate CIA (clinical investigation application) for the Urinary Placement Catheter (UPC) device, and requested a temporary enrollment hold on November 15th 2023.  

Background: The UPC is used for the intravesical placement of TAR-200 in the bladder. It does not have a CE mark and is a low-risk, Class I sterile device. The four SunRIse studies were designed to evaluate TAR-200 alone or in combination with cetrelimab and are not a clinical evaluation of the UPC to demonstrate conformity nor to evaluate or establish the performance, clinical benefit, or safety of the UPC. Therefore, per Article 62 (1) of the MDR, it was the opinion of the Sponsor at the time of trial design and start that a clinical investigation application to the health authority for this Class I sterile, low-risk device separate to the CTA application for the TAR-200 integral drug-device combination product was not warranted and confirmed with the Italian HA. 
  
AIFA has now communicated with the local team that the UPC device should have a Clinical Investigation Agreement (CIA) submitted for each study in order to resolve this issue.  AIFA asked to place a hold on enrolment for all SunRIse studies until the CIA is approved for use of the UPC device for SR 1, 2, 3, and 4 studies.   This impacts patients in screening (no ICF signed) by November 15th 2023, but patients on treatment can continue treatment.

The Sponsor acknowledges the understanding device-related requirements have evolved in the past years and has agreed to submit a separate CIA application as soon as possible.

Next Steps:
A Clinical Investigation Application (CIA) for the UPC device will be submitted for all SunRIse studies (SunRIse, 1, 2, 3, 4) to the AIFA.  An enrolment hold for new patients will be put in place until approval, which is expected to be expedited in under 60 days to minimize impact.",Closed,Janssen Pharmaceutical,Pharma - R&D,2023-11-15 20:14:36.000,"CLAES, ROBBY","Next Steps:
A Clinical Investigation Application (CIA) for the UPC device will be submitted for all SunRIse studies (SunRIse, 1, 2, 3, 4) to the AIFA.  An enrolment hold for new patients will be put in place until approval, which is expected to be expedited in under 60 days to minimize impact.",No Subsequent Escalation,
"01966ca2-7ddd-7085-bc3d-0966f1ce7f5a-e4852b03-abd2-42c4-92e6-c6163f389c57-1234-$record.itemRef",e4852b03-abd2-42c4-92e6-c6163f389c57,"01966ca2-7ddd-7085-bc3d-0966f1ce7f5a",CypressTC2 – Streamer Test,"1234",2025-05-03 00:00:00.000,"2356372",Level 2- Multiple dosing errors for one subject at different time points for MOM-M281-006 (EU-CTR) at Hungary site 1605,"Protocol non-compliance at Site #1605/PI Zsolt Nagy with potential impact to subject’s rights, safety, and data integrity for the MOM-M281-006 study.

Site errors in dose calculation occurred leading to 11 incorrect dosing events, either over or under-dosed, for one subject, #1605003. The site did not use the updated worksheets for dose calculation and did not record the expiration time of prepared infusion. The issue was noted by the Icon unblinded CRA during visit conducted on 26Jan2024. Icon indicated it happened during drug preparation, with first occurrence on 30Aug2023. Issue affects one subject that is in the open label extension part of the protocol. The site has one other subject that is discontinued. The trial currently has 74 randomized subjects.
 
Follow up information based on J&J Study Responsible Physician (SRP) discussion with site Sub-I on the current subject included subject is doing well, no additional problems. Nipocalimab has been studied up to 60 mg/kg q2w in participants with MG, and it was generally well tolerated. Doses greater than 10% of 15 mg/kg q2w are still within the dose range that has been studied in clinical trials. It is not expected that the dosing error during the period from OLE WK28 to OLE WK48 will have a future impact. Impact to subject safety: SRP recommends subject continue in Open Label Extension study. 

The JJIM team met with Icon on 15Feb2024 to discuss next steps and provided a summary from CRA visit on 14Feb2024, in which CRA confirmed confirmed that there was no AE, but 1 SAE reported for this subject that was not related to IP.",Closed,Janssen Pharmaceutical,Pharma - R&D,2024-02-26 16:41:49.000,"Swanger, Leticia","-Icon confirmed site was using correct worksheets as of 30Jan2024.
-Icon investigation/CAPA is due 05March2024, and it is expected to include further confirmation of all the mis-dosing calculations. 
-Potential additional actions pending Icon investigation.",No Subsequent Escalation,
"01966ca2-7ddd-7085-bc3d-0966f1ce7f5a-018ed883-c1d1-708a-a79d-0cb6954df0a0-1234-$record.itemRef","018ed883-c1d1-708a-a79d-0cb6954df0a0","01966ca2-7ddd-7085-bc3d-0966f1ce7f5a",CypressTC2 – Streamer Test,"1234",2025-05-03 00:00:00.000,"2363822",Critical GCP Audit Observation - Lack of Principal Investigator (PI) Oversight  Protocol 17000139BLC3001 (TAR-200),"Janssen (Pharmaceutical Companies of Johnson & Johnson) Research and Development (R&D) Quality conducted a routine onsite Clinical Investigator Site Audit of Dr. Lopez Chuken, Yamil,  protocol 17000139BLC3001, site S71-MX10004. The audit was performed in Monterrey, Mexico on 12-14 Mar 2024.

The auditor noted significant non-compliances at the site resulting in a Critical Observation focused on lack of Principal Investigator (PI) oversight resulting in several issues related to delegation, training, ICF, filing/ study documents review, compliance with local Ethics Committee PD and SUSAR submission timelines, SUSAR reviews and IP.

Background
The Study 17000139BLC3001 is a phase 3 study, to assess the efficacy of TAR-200 in combination with Cetrelimab versus concurrent Chemoradiotherapy in participants with Muscle-invasive urothelial carcinoma (MIBC) of the bladder who are not receiving radical cystectomy. 

The audited Site S71-MX10004 was opened on 25Nov21 and has screened 21 participants starting 08Apr22 (first subject screened), and has enrolled 10 participants. 

Issue description 
•	The site staff, including study coordinators, pharmacists, sub-investigators, and nurses, were performing study procedures without the required study training. The pharmacist did not have the necessary credentials, and there were errors in the preparation and administration of investigational products including the usage of outdated forms. 
•	Delays occurred in obtaining reconsent from study participants for multiple versions for several months, and there were issues with documentation process. 
•	Delegation log was updated after the announcement of the audit, with numerous changes without evidence of training in some cases.
•	Urological procedures were performed by partner institutions, leading to concerns about data completeness since only summaries are provided and not the original source. 
•	Protocol deviations and safety reports were not handled according to required timelines outlined by their local Ethics Committee. 
•	There were delays in reviewing study documents and SUSAR (instances were reviewed 1 year later), and not all necessary training was completed in a timely manner. 
•	Site uses a platform with username and password for the generation of source documents, which they print and sign for the medical chart, with no procedure to explain how it should be handled. During the audit, access or over the shoulder view was not provided to the auditor to establish if it is an electronic medical records (EMR) system or not.",Closed,Janssen Pharmaceutical,Pharma - R&D,2024-04-12 16:28:40.000,"MALTESE, PHILIP",Investigate audit observation,No Subsequent Escalation,
"01966ca2-7ddd-7085-bc3d-0966f1ce7f5a-01927335-aa1c-7a1e-9da0-4f13cabe7b90-1234-$record.itemRef","01927335-aa1c-7a1e-9da0-4f13cabe7b90","01966ca2-7ddd-7085-bc3d-0966f1ce7f5a",CypressTC2 – Streamer Test,"1234",2025-05-03 00:00:00.000,"2373232",Level 1- GCP noncompliance at Shanghai Children ‘s Medical Center for AC-065A203 and AC-065A310,"Unintentional noncompliance on source document process at Shanghai Children ‘s Medical Center, which was not fully compliant with ALCOA (Accurate, Legible, Contemporaneous, Original, & Attributable) principles, and traceability. This applies to both the AC-065A203 and AC-065A310 pediatric PAH trials (selexipag).
 
Patient visits were conducted by the main Sub Investigator (main Sub-I), accompanied with another sub investigator (Sub-I). As electronic Medical Records (eMR) system was not available at the facility, the main Sub-I documented the patient visits in loose notes that were used by the other Sub-I to enter data in the eMR system.
 
Summary of GCP non-conformance was confirmed during a compliance monitoring visit (4-5 June 2024):
The eMR user access credentials were shared between the two Sub-Is
Backdating of eMR entries and certified copies
Retrospective entries into eMR for multiple patients’ visits based on original source documents (loose paper notes) (not all certified copies were visible in the eMR)
Original source documents (loose paper notes) were discarded by site after eMR entries and verification against certified copies.
 
The above GCP non-conformance issues present an inspection risk for this site.
 
Site enrolled 6 out of 63 and 10 out of 138 enrolled patients in AC-065A203 Ped-Pk and AC-065A310 SALTO trials respectively.  
 
Data were included in Interim Analysis 1 (IA1) for the SALTO study and have been used for the registration in European Union Pediatric Investigation Plan requirements and EU submissions. Data for recent IA2 are used for the benefit risk assessment for the US submission.  PI did not complete signature in EDC RAVE for IA2.
 
Prior to completion of compliance monitoring visit, in April the Clinical team recommended to maintain data in the submission due to additional source data verification of both the site eMR and external sources that was conducted as part of preliminary investigation.  The team concluded that integrity of data had been confirmed as a result of this verification.",Closed,Janssen Pharmaceutical,Pharma - R&D,2024-06-24 20:23:56.000,"SELESKY, JOHN","-Documentation of the issue in the Clinical Study Report (eCRF data not signed by PI for IA2).
-To align with various stakeholders including Local RA to confirm if notification is required for Health Authority in China and to inform site IEC/IRB and GCP officer.
-Creation of the inspection narrative
-Perform further impact assessment on the data integrity and to determine next step for global and local submission",No Subsequent Escalation,
"01966ca2-7ddd-7085-bc3d-0966f1ce7f5a-01927335-aa1c-7554-9c69-199ab9661aa5-1234-$record.itemRef","01927335-aa1c-7554-9c69-199ab9661aa5","01966ca2-7ddd-7085-bc3d-0966f1ce7f5a",CypressTC2 – Streamer Test,"1234",2025-05-03 00:00:00.000,"2373662",For-cause GCP Investigational Site Inspection by Guangdong  ADR Center @ Site10023_Study CNTO1959CRD3001_CURVE#377870,"Parexel has received a formal notification regarding the for-cause site inspection of study CNTO1959CRD3001, which was scheduled on 26Jun2024. The site inspection was conducted at Site10023, The Sixth Affiliated Hospital, Sun Yat-sen University by Center for ADR monitoring of Guangdong. It was triggered by subject 101317 complaint related with insurance reimbursement due to complication from colonoscopy which as part of screening process.  According to the Clinical Team, “this subject has identified significant disease with an SESCD score 19 (severe) which in itself does bring on elevated risk of perforation with a colonoscopy.” 

Due to this subject met exclusion criteria #3 and #4 (Exclusion criteria #3.1: Has had any kind of bowel resection within 6 months, or any other intra-abdominal or other major surgery within 12 weeks before baseline. #4:Has a draining (ie, functioning) stoma or ostomy. ) , subject 101317 was subsequently determined as not eligible to study enrollment on 24May2021.
No formal report/findings has been shared with site on 26Jun2024.",Closed,Janssen Pharmaceutical,Pharma - R&D,2024-06-27 01:54:53.000,"Liu, Sha",TBD,No Subsequent Escalation,
